Id,CreatedAt,ModifiedAt,SubscriptionId,SubscriptionEndDate,SubscriptionStartDate,CustomerName,ClientManagerName,CommittedMrr,ChurnReason,ChurnReasonDescription,LastCustomerPortalLoginDate,LifetimeInMonths,AverageMailOpeningRate,HasFacebookPlusConfigWarning,HasFacebookPlusPerformanceWarning,FacebookPlusPerformanceWarningSeverity,HasGroceryPlusConfigWarning,HasGroceryPlusPerformanceWarning,GroceryPlusPerformanceWarningSeverity,HasFacebookConfigWarning,HasFacebookPerformanceWarning,FacebookPerformanceWarningSeverity,HasBannerConfigWarning,HasBannerPerformanceWarning,BannerPerformanceWarningSeverity,HasSeoProfileConfigWarning,HasSeoProfilePerformanceWarning,SeoProfilePerformanceWarningSeverity,HasFacebookAutopilotConfigWarning,HasFacebookAutopilotPerformanceWarning,FacebookAutopilotPerformanceWarningSeverity,HasUndertakerPlusConfigWarning,HasUndertakerPlusPerformanceWarning,UndertakerPlusPerformanceWarningSeverity,HasRealtorPlusConfigWarning,HasRealtorPlusPerformanceWarning,RealtorPlusPerformanceWarningSeverity,HasRealtorPropertyAssessmentConfigWarning,HasRealtorPropertyAssessmentPerformanceWarning,RealtorPropertyAssessmentPerformanceWarningSeverity,HasBusinessArticleConfigWarning,HasBusinessArticlePerformanceWarning,BusinessArticlePerformanceWarningSeverity,HasAutoarticleConfigWarning,HasAutoarticlePerformanceWarning,AutoarticlePerformanceWarningSeverity,HasFacebookImpressionCampaignConfigWarning,HasFacebookImpressionCampaignPerformanceWarning,FacebookImpressionCampaignPerformanceWarningSeverity,HasFacebookClickCampaignConfigWarning,HasFacebookClickCampaignPerformanceWarning,FacebookClickCampaignPerformanceWarningSeverity
09484352-bed8-40d3-914e-06c6858778c7,08/15/2025 14:11:00,,36b431a3-a207-4ceb-b695-43d70c20ca9b,11/29/2025 18:50:00,08/30/2024 17:50:00,Johnsen Optik,Mattias Løwe,1495.0000,Manglende forbrug hos kunde,"De forklarer at det simpelthen er fordi de føler de ikke får artiklerne brugt til deres fulde potentiele, og at det er deres egen skyld osv. kan godt lide produktet, men vil hellere spare penge, og vende tilbage når de har flere midler...",03/12/2025 14:16:34,14,75,,,,,,,False,True,High,False,False,,False,False,,,,,,,,,,,,,,False,True,Medium,,,,,,,,,
63b3144e-2d5e-4542-b619-1dbee2830871,05/20/2025 14:20:57,,e32c4e9d-7e33-4cda-90f5-668de43e7b89,11/13/2025 18:50:00,09/14/2022 17:50:00,Klinik tid til mig selv,Ole Lundgaard Sørensen,1495.0000,Ukendt årsag / Kunde svarer ikke,Kunden har ikke svaret,01/01/0001 00:00:00,37,100,,,,,,,False,True,Medium,False,False,,False,False,,,,,,,,,,,,,,False,True,High,,,,,,,,,
428600b7-5663-4110-bda8-2fa7a27ec419,08/01/2025 11:32:45,,845edb1d-71ef-447c-878f-9b02aa304d77,11/20/2025 18:50:00,11/21/2024 18:50:00,Florist Pernille DB,Thomas Dahl Johansen,1495.0000,Manglende udbytte,"Pernille fortæller at hun ikke har fået flere følger, føler ikke at folk læser artiklerne. Og at hun helt generelt ikke føler hun får noget ud af det.",07/10/2025 07:36:30,11,20,,,,,,,False,False,,False,True,High,False,False,,,,,,,,,,,,,,False,False,,,,,,,,,,
c7a357bd-cd9c-4706-94e2-3478bad63c15,08/08/2025 10:52:38,,16656621-42c7-4b5a-a7f8-5d7581a99634,11/16/2025 18:50:00,06/17/2025 17:50:00,ByKrums,Christoffer Nibe,1495.0000,Konkurs/ophør,"Hun stopper butikken, hun har dog aldrig betalt sine regninger, og stejlede faktisk over om der overhovedet var en aftale. Jeg har sendt hende et slutregnskab, meget dårlig aftale. ",06/12/2025 17:03:01,4,100,,,,,,,False,False,,False,False,,False,False,,,,,,,,,,,,,,False,False,,,,,,,,,,
10741a5b-eb3a-4b87-9726-4224d08f68b1,08/06/2025 11:33:39,,71744a89-80c3-4037-8224-fcf49e4a80dc,11/23/2025 23:00:00,01/24/2025 23:00:00,Vittrup Auto,Christoffer Nibe,1495.0000,Manglende udbytte,syntes det er dyrt. ift. at det ikke giver så meget,01/30/2025 08:08:37,9,100,,,,,,,False,True,Low,False,False,,False,False,,,,,,,,,,,,,,False,True,Medium,,,,,,,,,
9e8f5cd1-a11d-4c1c-bfd8-51313f0fcac0,08/15/2025 13:46:55,,e5c3cb15-6142-43bd-8abc-a6e161442e46,11/30/2025 18:50:00,10/01/2024 17:50:00,Skovbygaard,Christoffer Nibe,1495.0000,Manglende udbytte,"""Bruger for mange penge, uden at få noget ud af det""",01/01/0001 00:00:00,13,80,,,,,,,False,True,Medium,False,True,Low,False,False,,,,,,,,,,,,,,False,True,Low,,,,,,,,,
0c2caedc-bcb4-4714-863f-52802a739cd7,08/06/2025 11:04:54,,40217b83-4d64-40b7-b033-ec1ebfe5fdc6,11/28/2025 18:50:00,11/29/2024 18:50:00,Fri Bikeshop Nykøbing Mors,Thomas Dahl Johansen,1299.0000,Manglende udbytte,"Han kunne høre på sine kunder at det ikke var gennem vores services at han fik kunderne, og i og med at han har indgået aftalen for at teste det af, har han valgt at opsige aftalen.",08/06/2025 10:43:15,11,12,,,,,,,False,True,High,False,True,High,False,False,,,,,,,,,,,,,,False,True,Low,,,,,,,,,
2aca6dbb-5960-4c09-98b7-563130366cf0,04/15/2025 14:42:01,,72c92032-158f-4a26-a067-510e2032cbf8,11/29/2025 18:50:00,10/31/2024 18:50:00,"Seby Trade ",Mattias Løwe,598.0000,Økonomi,"De lukker biksen, men har i øvrigt slet ikke betalt én eneste regning, selv efter jeg har rykket for dem flere gange. KAM.",01/01/0001 00:00:00,12,33,,,,,,,,,,False,False,,False,False,,,,,,,,,,,,,,False,False,,,,,,,,,,
049f7479-cdcd-4b84-a710-963025ac71fb,08/11/2025 09:55:06,,be884077-cb8d-4544-a9c7-8397c4654b42,11/30/2025 18:50:00,08/01/2024 17:50:00,Søndergades Auto,Christoffer Nibe,1495.0000,Kunde har ikke forstået konceptet,"Harry opsiger, da han ikke mener han får noget ud af aftalen overhovedet. Lidt knotten",01/01/0001 00:00:00,15,0,,,,,,,,,,False,True,High,False,False,,,,,,,,,,,,,,False,True,High,,,,,,,,,
a7f963cb-3776-4570-85b4-9f1598857418,07/30/2025 14:32:57,,faacd86b-5182-4d27-ae3d-dc7a341d67c3,11/17/2025 23:00:00,01/18/2025 23:00:00,"Vin & Vin Hobro ",Christoffer Nibe,1495.0000,Ukendt årsag / Kunde svarer ikke,"Per nævner at de siger op, kun fordi at aftalen fra starten ligesom var på at de kun vil køre med de i 6 måneder og mærke forandringen derefter.

Så der egentlig ikke noget der som sådan ligger bag det, udover at det er det han siger de ""aftalte"" med nibe, back in the day.",07/30/2025 10:13:27,9,100,,,,,,,False,True,Low,False,False,,False,False,,,,,,,,,,,,,,False,False,,,,,,,,,,
6b211aa8-95f6-4ba7-98fa-b2f13f53e6f9,07/29/2025 14:53:27,,de230186-67f3-4da5-b12b-30a3f612553a,11/04/2025 18:50:00,06/05/2024 17:50:00,Frisdal Køreskole,Christoffer Nibe,1495.0000,Found a better fit with a competitor,"de unge mennesker bruger tiktok og de prøver deres kræfter der.

for pengene de bruger, så giver det mere mening ved tiktok. for at ramme de unge",01/01/0001 00:00:00,16,80,,,,,,,False,False,,False,False,,False,False,,,,,,,,,,,,,,False,True,Medium,,,,,,,,,
43459e11-da89-4dea-962e-de2312ab35ba,08/06/2025 09:41:51,,d327a091-f336-4a60-af8d-b4deb7abec46,11/11/2025 23:00:00,08/12/2024 22:00:00,Den Røde Kost,Christoffer Nibe,747.5000,Found a better fit with a competitor,Hun skriver over mail at det er tid til at prøve noget nyt,02/22/2025 17:08:52,14,100,,,,,,,False,True,High,False,True,High,False,False,,,,,,,,,,,,,,False,False,,,,,,,,,,
42ae1dab-020b-475a-8522-e270980a9307,07/28/2025 14:20:42,,daaa4030-bd57-48f5-8f2c-cf47aed4d195,11/06/2025 18:50:00,03/07/2025 18:50:00,NORDJYSK MOTOR CO. ApS,Christoffer Nibe,1695.0000,Manglende udbytte,"har prøvet det, kunne ikke mærke nogen effekt af det.

Sagde til nibe dengang de startede, at han er villig til at giv det et forsøg, og hvis der ikke var noget kød så opsiger han.",06/09/2025 11:59:28,7,60,,,,,,,False,False,,False,False,,False,False,,,,,,,,,,,,,,False,False,,,,,,,,,,
36993045-1e18-4751-9362-eb8a9114884f,08/12/2025 12:48:44,,abdf4682-a235-4a08-be1c-e1290997e008,11/22/2025 18:50:00,01/23/2025 18:50:00,Njordkøkken,"Søren Schrøder Rasmussen ",1495.0000,Found a better fit with a competitor,"ikke andet end at det var planen fra starten, at have et samarbejde i ca. 6 måneder, og derefter prøve noget nyt.

Han fortæller at han er glad for os, og takker for samarbejdet",04/29/2025 12:37:05,9,36,,,,,,,False,False,,False,True,Low,False,False,,,,,,,,,,,,,,False,True,Medium,,,,,,,,,
77aad643-db75-4121-8e10-ee359a4db253,08/04/2025 10:16:55,,6011599f-c4b0-4d14-89c9-c08a44cd4f97,11/04/2025 18:50:00,08/05/2024 17:50:00,MALERFIRMAET HENNING KRISTENSEN,Thomas Dahl Johansen,995.0000,Manglende udbytte,John fortæller at de ikke syntes det er de 1000kr om måneden værd - i deres øjne,01/17/2025 14:30:08,14,25,,,,,,,,,,False,False,,False,False,,,,,,,,,,,,,,False,True,Low,,,,,,,,,
